{
  "skill": "messaging-architecture",
  "domain": "content",
  "_note": "Rubric domain-truth fixture (road-to-domain-soundness Phase 2, rubric target). The criterion names a CITED EXTERNAL practice/standard — NOT the skill's own output (blocker: domain-competence-for-answer-keys, option a). Authored as a maintainer-RATIFICATION CANDIDATE: rubric is NON-deterministic (pinned-judge known-limit); the Phase-3 run + --write-floor ratchet-pin + per-domain backed-CLAIMS remain the maintainer's gate.",
  "cases": [
    {
      "id": "matches-message-house-model",
      "scenario": "Design the messaging architecture for our product launch.",
      "source": "The message-house framework (one core message -> supporting pillars -> proof points per pillar) + positioning-before-messaging (Dunford, 'Obviously Awesome').",
      "check": {
        "kind": "rubric",
        "criterion": "Matches the message-house model: exactly one core message, a small set of supporting pillars, and concrete proof points under each pillar, grounded in a NAMED target audience - not a flat list of slogans or adjectives."
      }
    }
  ]
}
